{
  "$schema": "http://json-schema.org/draft-04/schema#",
  "type": "object",
  "properties": {
    "id": {
      "type": "string"
    },
    "instanceId": {
      "type": "string"
    },
    "title": {
      "type": "string"
    },
    "barcode": {
      "type": "string"
    },
    "status": {
      "type": "object",
      "properties": {
        "name": {
          "type": "string"
        }
      }
    },
    "materialTypeId": {
      "type": "string"
    },
    "loanTypeId": {
      "type": "string"
    },
    "location": {
      "type": "object",
      "properties": {
        "name": {
          "type": "string"
        }
      }
    }
  },
  "required": [
    "instanceId",
    "barcode"
  ]
}
