{
  "id": "bb5a6689-c008-4c96-8f8f-b666850ee12d",
  "instanceId": "a89eccf0-57a6-495e-898d-32b9b2210f2f",
  "title": "Interesting Times",
  "barcode": "326547658598",
  "materialTypeId": "1a54b431-2e4f-452d-9cae-9cee66c9a892",
  "loanTypeId": "2b94c631-fca9-a892-c730-03ee529ffe27",
  "status": {
    "name": "Available"
  },
  "location": {
    "name": "Annex Library"
  }
}
