{
  "id": "23fdb0bc-ab58-442a-b326-577a96204487",
  "instanceId": "cf23adf0-61ba-4887-bf82-956c4aae2260",
  "title": "Temeraire",
  "barcode": "653285216743",
  "materialTypeId": "1a54b431-2e4f-452d-9cae-9cee66c9a892",
  "loanTypeId": "2b94c631-fca9-a892-c730-03ee529ffe27",
  "status": {
    "name": "Checked Out"
  },
  "location": {
    "name": "Annex Library"
  }
}
