{
  "id": "0b96a642-5e7f-452d-9cae-9cee66c9a892",
  "instanceId": "cf23adf0-61ba-4887-bf82-956c4aae2260",
  "title": "Temeraire",
  "barcode": "645398607547",
  "materialTypeId": "1a54b431-2e4f-452d-9cae-9cee66c9a892",
  "loanTypeId": "2b94c631-fca9-a892-c730-03ee529ffe27",
  "status": {
    "name": "Available"
  },
  "location": {
    "name": "Main Library"
  }
}
