{
  "id": "23f2c8e1-bd5d-4f27-9398-a688c998808a",
  "instanceId": "6506b79b-7702-48b2-9774-a1c538fdd34e",
  "title": "Nod",
  "barcode": "697685458679",
  "materialTypeId": "1a54b431-2e4f-452d-9cae-9cee66c9a892",
  "loanTypeId": "2e48e713-17f3-7c13-09f8-23845bb210a4",
  "status": {
    "name": "Checked Out"
  },
  "location": {
    "name": "Main Library"
  }
}
