{
  "id": "1b6d3338-186e-4e35-9e75-1b886b0da53e",
  "instanceId": "7fbd5d84-62d1-44c6-9c45-6cb173998bbd",
  "title": "Bridget Jones's Baby",
  "barcode": "453987605438",
  "materialTypeId": "1a54b431-2e4f-452d-9cae-9cee66c9a892",
  "loanTypeId": "2b94c631-fca9-a892-c730-03ee529ffe27",
  "status": {
    "name": "Checked Out"
  },
  "location": {
    "name": "Main Library"
  }
}
