{
  "id": "459afaba-5b39-468d-9072-eb1685e0ddf4",
  "instanceId": "f31a36de-fcf8-44f9-87ef-a55d06ad21ae",
  "title": "The Girl on the Train",
  "barcode": "765475420716",
  "materialTypeId": "1a54b431-2e4f-452d-9cae-9cee66c9a892",
  "loanTypeId": "2b94c631-fca9-a892-c730-03ee529ffe27",
  "status": {
    "name": "Available"
  },
  "location": {
    "name": "Annex Library"
  }
}
